{
  "id": "TrueFruitAngler",
  "name": "Gerçek Meyve Balığı",
  "description": "Su altında yuva kazmak, barınak yapmak ve yırtıcıları uzaklaştırmak için boynuz benzeri kıkırdaklı bir yapıya sahip olan orta büyüklükte ve yuvarlak bir balık.<br/>Bu tür balon balıkları genelde yeşilimsi bir tona sahip olurlar. Görünümleri olgunlaşmamış bir meyveye benzediğinden ötürü \"Gerçek Meyve\" ismini almıştır. Eti oldukça yağlı ve besleyicidir ama usulüne göre işlenmezse veya safra kesesi geç çıkarılırsa tadı olgunlaşmamış bir meyve gibi ekşi olur. Bundan ötürü \"bu balığı lezzetli yapmak\" tüm şeflerin ölçüldüğü standart haline gelmiştir.",
  "rarity": 3,
  "source": [
    "Balık tutarak elde edilir."
  ],
  "bait": {
    "id": "SugardewBait",
    "name": "Şeker Özü Yemi",
    "rarity": 2
  },
  "version": "5.0"
}